{
  "$schema": "https://json-schema.org/draft/2020-12/schema",
  "type": "object",
  "properties": {
    "schemaVersion": {
      "type": "number",
      "const": 1
    },
    "id": {
      "type": "string",
      "maxLength": 48,
      "pattern": "^[a-z][a-z0-9]*(?:-[a-z0-9]+)*$"
    },
    "name": {
      "type": "string",
      "minLength": 1,
      "maxLength": 160
    },
    "applicationId": {
      "type": "string",
      "pattern": "^[a-z][a-z0-9]*(?:\\.[a-z][a-z0-9]*){2,}$"
    },
    "daemonPort": {
      "type": "integer",
      "minimum": 1024,
      "maximum": 65535
    },
    "fullName": {
      "type": "string",
      "minLength": 1,
      "maxLength": 160
    },
    "description": {
      "type": "string",
      "minLength": 1,
      "maxLength": 160
    },
    "publisher": {
      "type": "string",
      "minLength": 1,
      "maxLength": 160
    },
    "cliName": {
      "type": "string",
      "maxLength": 48,
      "pattern": "^[a-z][a-z0-9]*(?:-[a-z0-9]+)*$"
    },
    "desktopBinaryName": {
      "type": "string",
      "maxLength": 48,
      "pattern": "^[a-z][a-z0-9]*(?:-[a-z0-9]+)*$"
    },
    "homeDir": {
      "type": "string",
      "pattern": "^\\.[a-z][a-z0-9-]*$"
    },
    "envPrefix": {
      "type": "string",
      "pattern": "^[A-Z][A-Z0-9_]*$"
    },
    "scheme": {
      "type": "string",
      "maxLength": 48,
      "pattern": "^[a-z][a-z0-9]*(?:-[a-z0-9]+)*$"
    },
    "serviceName": {
      "type": "string",
      "maxLength": 48,
      "pattern": "^[a-z][a-z0-9]*(?:-[a-z0-9]+)*$"
    },
    "launchdLabel": {
      "type": "string",
      "pattern": "^[a-z][a-z0-9.-]*$"
    },
    "artifactPrefix": {
      "type": "string",
      "pattern": "^[a-zA-Z][a-zA-Z0-9-]*$"
    },
    "assets": {
      "type": "object",
      "properties": {
        "icon": {
          "type": "string",
          "minLength": 1
        },
        "ios": {
          "type": "string",
          "minLength": 1
        },
        "foreground": {
          "type": "string",
          "minLength": 1
        },
        "notification": {
          "type": "string",
          "minLength": 1
        },
        "splash": {
          "type": "string",
          "minLength": 1
        },
        "faviconLight": {
          "type": "string",
          "minLength": 1
        },
        "faviconDark": {
          "type": "string",
          "minLength": 1
        }
      },
      "required": ["icon"],
      "additionalProperties": false
    },
    "colors": {
      "type": "object",
      "properties": {
        "light": {
          "type": "object",
          "properties": {
            "accent": {
              "type": "string",
              "pattern": "^#[0-9a-fA-F]{6}$"
            },
            "accentForeground": {
              "type": "string",
              "pattern": "^#[0-9a-fA-F]{6}$"
            },
            "background": {
              "type": "string",
              "pattern": "^#[0-9a-fA-F]{6}$"
            },
            "foreground": {
              "type": "string",
              "pattern": "^#[0-9a-fA-F]{6}$"
            },
            "accentBright": {
              "type": "string",
              "pattern": "^#[0-9a-fA-F]{6}$"
            }
          },
          "required": ["accent", "accentForeground", "background", "foreground"],
          "additionalProperties": false
        },
        "dark": {
          "type": "object",
          "properties": {
            "accent": {
              "type": "string",
              "pattern": "^#[0-9a-fA-F]{6}$"
            },
            "accentForeground": {
              "type": "string",
              "pattern": "^#[0-9a-fA-F]{6}$"
            },
            "background": {
              "type": "string",
              "pattern": "^#[0-9a-fA-F]{6}$"
            },
            "foreground": {
              "type": "string",
              "pattern": "^#[0-9a-fA-F]{6}$"
            },
            "accentBright": {
              "type": "string",
              "pattern": "^#[0-9a-fA-F]{6}$"
            }
          },
          "required": ["accent", "accentForeground", "background", "foreground"],
          "additionalProperties": false
        }
      },
      "additionalProperties": false
    },
    "installer": {
      "type": "object",
      "properties": {
        "tagline": {
          "type": "string",
          "minLength": 1,
          "maxLength": 80
        },
        "colors": {
          "type": "object",
          "properties": {
            "background": {
              "type": "string",
              "pattern": "^#[0-9a-fA-F]{6}$"
            },
            "surface": {
              "type": "string",
              "pattern": "^#[0-9a-fA-F]{6}$"
            },
            "foreground": {
              "type": "string",
              "pattern": "^#[0-9a-fA-F]{6}$"
            },
            "mutedForeground": {
              "type": "string",
              "pattern": "^#[0-9a-fA-F]{6}$"
            },
            "accent": {
              "type": "string",
              "pattern": "^#[0-9a-fA-F]{6}$"
            },
            "accentBright": {
              "type": "string",
              "pattern": "^#[0-9a-fA-F]{6}$"
            },
            "success": {
              "type": "string",
              "pattern": "^#[0-9a-fA-F]{6}$"
            },
            "danger": {
              "type": "string",
              "pattern": "^#[0-9a-fA-F]{6}$"
            }
          },
          "additionalProperties": false
        },
        "copy": {
          "type": "object",
          "properties": {
            "installing": {
              "type": "string",
              "minLength": 1,
              "maxLength": 80
            },
            "migrating": {
              "type": "string",
              "minLength": 1,
              "maxLength": 80
            },
            "ready": {
              "type": "string",
              "minLength": 1,
              "maxLength": 80
            },
            "launching": {
              "type": "string",
              "minLength": 1,
              "maxLength": 80
            },
            "elevationRequired": {
              "type": "string",
              "minLength": 1,
              "maxLength": 160
            }
          },
          "additionalProperties": false
        }
      },
      "additionalProperties": false
    },
    "links": {
      "type": "object",
      "properties": {
        "website": {
          "type": "string",
          "format": "uri"
        },
        "support": {
          "type": "string",
          "format": "uri"
        },
        "docs": {
          "type": "string",
          "format": "uri"
        },
        "source": {
          "type": "string",
          "format": "uri"
        },
        "installer": {
          "type": "string",
          "format": "uri"
        }
      },
      "additionalProperties": false
    },
    "services": {
      "type": "object",
      "properties": {
        "pairingUrl": {
          "type": "string",
          "format": "uri"
        },
        "allowedOrigins": {
          "type": "array",
          "items": {
            "type": "string",
            "format": "uri"
          }
        }
      },
      "additionalProperties": false
    },
    "distribution": {
      "type": "object",
      "properties": {
        "repository": {
          "type": "string",
          "pattern": "^[a-zA-Z0-9_.-]+\\/[a-zA-Z0-9_.-]+$"
        },
        "updates": {
          "type": "string",
          "enum": ["disabled", "github-release", "tauri-signed"]
        },
        "updaterPublicKey": {
          "type": "string",
          "minLength": 1
        },
        "dockerImage": {
          "type": "string",
          "pattern": "^[a-z0-9][a-z0-9./_-]*$"
        },
        "pairingImage": {
          "type": "string",
          "pattern": "^[a-z0-9][a-z0-9./_-]*$"
        },
        "iosStoreId": {
          "type": "string",
          "pattern": "^\\d+$"
        },
        "expoProjectId": {
          "type": "string",
          "format": "uuid",
          "pattern": "^([0-9a-fA-F]{8}-[0-9a-fA-F]{4}-[1-8][0-9a-fA-F]{3}-[89abAB][0-9a-fA-F]{3}-[0-9a-fA-F]{12}|00000000-0000-0000-0000-000000000000|ffffffff-ffff-ffff-ffff-ffffffffffff)$"
        }
      },
      "additionalProperties": false
    },
    "pairing": {
      "type": "object",
      "properties": {
        "autoConfirmLocal": {
          "type": "boolean"
        }
      },
      "additionalProperties": false
    },
    "projects": {
      "type": "object",
      "properties": {
        "defaultDirectory": {
          "type": "string",
          "minLength": 1
        }
      },
      "additionalProperties": false
    },
    "hostSettings": {
      "type": "object",
      "properties": {
        "hiddenSections": {
          "type": "array",
          "items": {
            "type": "string",
            "enum": [
              "projects",
              "pair-device",
              "devices",
              "agents",
              "providers",
              "usage",
              "terminals",
              "host"
            ]
          }
        }
      },
      "additionalProperties": false
    },
    "daemon": {
      "type": "object",
      "properties": {
        "bind": {
          "type": "string",
          "enum": ["all", "loopback"]
        },
        "workspaceServicesBind": {
          "type": "string",
          "enum": ["all", "loopback"]
        },
        "claimMode": {
          "type": "boolean"
        },
        "trustLan": {
          "type": "boolean"
        },
        "claimScope": {
          "type": "string",
          "enum": ["any", "local"]
        },
        "providerUpdateChecks": {
          "type": "boolean"
        }
      },
      "additionalProperties": false
    },
    "providers": {
      "type": "object",
      "properties": {
        "allowed": {
          "minItems": 1,
          "type": "array",
          "items": {
            "type": "string",
            "maxLength": 48,
            "pattern": "^[a-z][a-z0-9]*(?:-[a-z0-9]+)*$"
          }
        },
        "models": {
          "type": "object",
          "propertyNames": {
            "type": "string",
            "maxLength": 48,
            "pattern": "^[a-z][a-z0-9]*(?:-[a-z0-9]+)*$"
          },
          "additionalProperties": {
            "type": "object",
            "properties": {
              "allow": {
                "type": "array",
                "items": {
                  "type": "string",
                  "maxLength": 160,
                  "pattern": "^[A-Za-z0-9*][A-Za-z0-9._:/@*-]*$"
                }
              },
              "deny": {
                "type": "array",
                "items": {
                  "type": "string",
                  "maxLength": 160,
                  "pattern": "^[A-Za-z0-9*][A-Za-z0-9._:/@*-]*$"
                }
              }
            },
            "additionalProperties": false
          }
        }
      },
      "additionalProperties": false
    },
    "mobile": {
      "type": "object",
      "properties": {
        "enabled": {
          "type": "boolean"
        }
      },
      "additionalProperties": false
    },
    "plugins": {
      "type": "object",
      "properties": {
        "enabled": {
          "type": "boolean"
        },
        "officialRepo": {
          "type": "boolean"
        },
        "repos": {
          "type": "array",
          "items": {
            "type": "object",
            "properties": {
              "name": {
                "type": "string",
                "minLength": 1,
                "maxLength": 160
              },
              "url": {
                "type": "string",
                "format": "uri"
              },
              "publicKey": {
                "type": "string",
                "pattern": "^[A-Za-z0-9+/]{43}=$"
              }
            },
            "required": ["name", "url", "publicKey"],
            "additionalProperties": false
          }
        },
        "allowUserRepos": {
          "type": "boolean"
        },
        "developerMode": {
          "type": "string",
          "enum": ["allowed", "forbidden"]
        },
        "allow": {
          "type": "array",
          "items": {
            "type": "string",
            "pattern": "^[a-z0-9.*-]+$"
          }
        },
        "deny": {
          "type": "array",
          "items": {
            "type": "string",
            "pattern": "^[a-z0-9.*-]+$"
          }
        },
        "preinstalled": {
          "type": "array",
          "items": {
            "type": "object",
            "properties": {
              "id": {
                "type": "string",
                "pattern": "^[a-z0-9]+(\\.[a-z0-9-]+)+$"
              },
              "version": {
                "type": "string",
                "minLength": 1
              }
            },
            "required": ["id"],
            "additionalProperties": false
          }
        },
        "autoUpdate": {
          "type": "string",
          "enum": ["off", "brand-repos", "all"]
        },
        "remoteControl": {
          "type": "string",
          "enum": ["allowed", "forbidden"]
        }
      },
      "additionalProperties": false
    },
    "channels": {
      "type": "object",
      "properties": {
        "beta": {
          "type": "object",
          "properties": {
            "name": {
              "type": "string",
              "minLength": 1,
              "maxLength": 160
            },
            "fullName": {
              "type": "string",
              "minLength": 1,
              "maxLength": 160
            },
            "applicationId": {
              "type": "string",
              "pattern": "^[a-z][a-z0-9]*(?:\\.[a-z][a-z0-9]*){2,}$"
            },
            "daemonPort": {
              "type": "integer",
              "minimum": 1024,
              "maximum": 65535
            },
            "cliName": {
              "type": "string",
              "maxLength": 48,
              "pattern": "^[a-z][a-z0-9]*(?:-[a-z0-9]+)*$"
            },
            "desktopBinaryName": {
              "type": "string",
              "maxLength": 48,
              "pattern": "^[a-z][a-z0-9]*(?:-[a-z0-9]+)*$"
            },
            "homeDir": {
              "type": "string",
              "pattern": "^\\.[a-z][a-z0-9-]*$"
            },
            "envPrefix": {
              "type": "string",
              "pattern": "^[A-Z][A-Z0-9_]*$"
            },
            "scheme": {
              "type": "string",
              "maxLength": 48,
              "pattern": "^[a-z][a-z0-9]*(?:-[a-z0-9]+)*$"
            },
            "serviceName": {
              "type": "string",
              "maxLength": 48,
              "pattern": "^[a-z][a-z0-9]*(?:-[a-z0-9]+)*$"
            },
            "launchdLabel": {
              "type": "string",
              "pattern": "^[a-z][a-z0-9.-]*$"
            },
            "artifactPrefix": {
              "type": "string",
              "pattern": "^[a-zA-Z][a-zA-Z0-9-]*$"
            },
            "badge": {
              "type": "boolean"
            }
          },
          "additionalProperties": false
        }
      },
      "additionalProperties": false
    }
  },
  "required": ["schemaVersion", "id", "name", "applicationId", "daemonPort", "assets"],
  "additionalProperties": false
}
